product_id,product_name,rank,intent_id,intent_name,score,evidence,reason,ontology_version,labeling_run_id,model,created_at
P048,Jack Stands (2-Ton),2,IN_HMS_02,Home Safety & Security,0.9,support stands,"These stands provide crucial safety when working under a vehicle, preventing accidents.",v1,run_20260123_013928,gemini-2.5-flash,2026-01-23T01:39:28.622457
P048,Jack Stands (2-Ton),3,IN_HMS_01,Home Repairs & DIY,0.8,support stands,"While specific to cars, they fall under the broader category of tools for home-related repairs and DIY projects.",v1,run_20260123_013928,gemini-2.5-flash,2026-01-23T01:39:28.622457
P048,Jack Stands (2-Ton),4,IN_THI_01,General Tools & Hardware,0.7,steel support stands,Jack stands are a type of heavy-duty tool or hardware used for specific tasks.,v1,run_20260123_013928,gemini-2.5-flash,2026-01-23T01:39:28.622457
P049,Oil Drain Pan,1,IN_AVM_01,Vehicle Maintenance & Repair,1.0,oil drain pan,This product is specifically designed for collecting oil during vehicle maintenance.,v1,run_20260123_013928,gemini-2.5-flash,2026-01-23T01:39:28.622457
P049,Oil Drain Pan,2,IN_THI_01,General Tools & Hardware,0.7,plastic basin with pour spout,It is a general-purpose basin tool used for fluid management.,v1,run_20260123_013928,gemini-2.5-flash,2026-01-23T01:39:28.622457
P049,Oil Drain Pan,3,IN_CHE_01,Home Cleaning & Maintenance,0.6,drain pan,"It helps manage waste fluids, contributing to cleanliness during repairs.",v1,run_20260123_013928,gemini-2.5-flash,2026-01-23T01:39:28.622457
P049,Oil Drain Pan,4,IN_HMS_01,Home Repairs & DIY,0.5,drain pan,Vehicle maintenance often falls under DIY repair projects.,v1,run_20260123_013928,gemini-2.5-flash,2026-01-23T01:39:28.622457
P049,Oil Drain Pan,5,IN_SEL_01,Eco-Conscious Products & Practices,0.4,drain pan,Using a drain pan facilitates proper and eco-conscious disposal of used oil.,v1,run_20260123_013928,gemini-2.5-flash,2026-01-23T01:39:28.622457
P050,Shop Towels (Roll),1,IN_AVM_01,Vehicle Maintenance & Repair,1.0,heavy-duty blue paper towels for oil/grease,These towels are specifically for cleaning up oil and grease from vehicle maintenance.,v1,run_20260123_013928,gemini-2.5-flash,2026-01-23T01:39:28.622457
P050,Shop Towels (Roll),2,IN_CHE_01,Home Cleaning & Maintenance,0.8,heavy-duty blue paper towels,Towels are essential for general cleaning and maintenance tasks.,v1,run_20260123_013928,gemini-2.5-flash,2026-01-23T01:39:28.622457
P050,Shop Towels (Roll),3,IN_THI_01,General Tools & Hardware,0.7,shop towels,Shop towels are a common consumable tool in workshops and for various repairs.,v1,run_20260123_013928,gemini-2.5-flash,2026-01-23T01:39:28.622457
P050,Shop Towels (Roll),4,IN_HMS_01,Home Repairs & DIY,0.6,shop towels,These towels are useful for cleaning during home and DIY repair projects.,v1,run_20260123_013928,gemini-2.5-flash,2026-01-23T01:39:28.622457
P050,Shop Towels (Roll),5,IN_GOL_01,Garden Care & Cultivation,0.3,heavy-duty blue paper towels for oil/grease,These towels can be used for cleaning and maintaining garden tools and equipment.,v1,run_20260123_013928,gemini-2.5-flash,2026-01-23T01:39:28.622457
P051,Car Wax Applicator,1,IN_AVM_01,Vehicle Maintenance & Repair,1.0,car wax applicator,This product is specifically used for applying car wax as part of vehicle maintenance.,v1,run_20260123_013928,gemini-2.5-flash,2026-01-23T01:39:28.622457
P051,Car Wax Applicator,2,IN_AVM_02,Automotive Safety & Tech,0.7,car wax applicator,"Waxing protects the car's paint, contributing to its longevity and appearance.",v1,run_20260123_013928,gemini-2.5-flash,2026-01-23T01:39:28.622457
P051,Car Wax Applicator,3,IN_CHE_01,Home Cleaning & Maintenance,0.5,microfiber-wrapped foam pads,"The pads are tools for application and cleaning, similar to general home maintenance items.",v1,run_20260123_013928,gemini-2.5-flash,2026-01-23T01:39:28.622457
P051,Car Wax Applicator,4,IN_HDA_01,Enhancing Home Aesthetics,0.4,detailing,Car detailing aims to enhance the aesthetic appeal of a vehicle.,v1,run_20260123_013928,gemini-2.5-flash,2026-01-23T01:39:28.622457
P051,Car Wax Applicator,5,IN_THI_01,General Tools & Hardware,0.3,applicator,An applicator is a general tool for applying substances.,v1,run_20260123_013928,gemini-2.5-flash,2026-01-23T01:39:28.622457
P052,Scratch Remover Pen,1,IN_AVM_01,Vehicle Maintenance & Repair,1.0,scratch remover pen | clear coat filler for minor car paint scuffs,This product is designed for minor repairs to a vehicle's paintwork.,v1,run_20260123_013928,gemini-2.5-flash,2026-01-23T01:39:28.622457
P052,Scratch Remover Pen,2,IN_AVM_02,Automotive Safety & Tech,0.7,clear coat filler,Repairing scuffs helps maintain the vehicle's protective clear coat and overall condition.,v1,run_20260123_013928,gemini-2.5-flash,2026-01-23T01:39:28.622457
P052,Scratch Remover Pen,3,IN_HMS_01,Home Repairs & DIY,0.6,scratch remover pen,"It is a DIY repair tool for cosmetic damage, similar to home repair tasks.",v1,run_20260123_013928,gemini-2.5-flash,2026-01-23T01:39:28.622457
P052,Scratch Remover Pen,4,IN_HDA_01,Enhancing Home Aesthetics,0.5,scratch remover,The primary purpose is to improve the aesthetic appearance of the car by removing visible damage.,v1,run_20260123_013928,gemini-2.5-flash,2026-01-23T01:39:28.622457
P052,Scratch Remover Pen,5,IN_THI_01,General Tools & Hardware,0.4,pen,A pen-style applicator for filler can be considered a specialized general tool.,v1,run_20260123_013928,gemini-2.5-flash,2026-01-23T01:39:28.622457
P053,Trailer Hitch Ball,1,IN_AVM_02,Automotive Safety & Tech,1.0,trailer hitch ball for towing,This product is a vehicle accessory designed to enable a specific automotive function (towing).,v1,run_20260123_013928,gemini-2.5-flash,2026-01-23T01:39:28.622457
P053,Trailer Hitch Ball,2,IN_AVM_01,Vehicle Maintenance & Repair,0.8,trailer hitch ball,"While not strictly repair, it's an essential component for a vehicle's utility, often installed or maintained.",v1,run_20260123_013928,gemini-2.5-flash,2026-01-23T01:39:28.622457
P053,Trailer Hitch Ball,3,IN_THI_01,General Tools & Hardware,0.7,chrome steel ball,"A hitch ball is a piece of hardware used for a specific function, similar to general tools.",v1,run_20260123_013928,gemini-2.5-flash,2026-01-23T01:39:28.622457
P053,Trailer Hitch Ball,4,IN_ORS_01,Outdoor Gear & Activities,0.6,for towing,"Towing often relates to outdoor activities like camping, boating, or hauling recreational gear.",v1,run_20260123_013928,gemini-2.5-flash,2026-01-23T01:39:28.622457
P053,Trailer Hitch Ball,5,IN_TC_01,Travel Essentials & Efficiency,0.5,for towing,"Towing is frequently used for travel, such as with trailers or RVs.",v1,run_20260123_013928,gemini-2.5-flash,2026-01-23T01:39:28.622457
P054,Car Battery Charger,1,IN_AVM_01,Vehicle Maintenance & Repair,1.0,car battery charger | automatic maintainer for vehicle,This product is specifically designed for maintaining and repairing a vehicle's battery.,v1,run_20260123_013928,gemini-2.5-flash,2026-01-23T01:39:28.622457
P054,Car Battery Charger,2,IN_AVM_02,Automotive Safety & Tech,0.8,car battery charger,"A functioning battery is crucial for vehicle safety and reliability, which this product ensures.",v1,run_20260123_013928,gemini-2.5-flash,2026-01-23T01:39:28.622457
P054,Car Battery Charger,3,IN_THI_01,General Tools & Hardware,0.7,charger,A battery charger is a specialized tool used for maintenance tasks.,v1,run_20260123_013928,gemini-2.5-flash,2026-01-23T01:39:28.622457
P054,Car Battery Charger,4,IN_HMS_01,Home Repairs & DIY,0.6,maintainer for vehicle,"This product supports DIY vehicle maintenance, which falls under general repair skills.",v1,run_20260123_013928,gemini-2.5-flash,2026-01-23T01:39:28.622457
P054,Car Battery Charger,5,IN_CET_01,Electronic Devices & Gadgets,0.5,12v automatic maintainer,The charger is an electronic device with specific functionality.,v1,run_20260123_013928,gemini-2.5-flash,2026-01-23T01:39:28.622457
P055,Seat Belt Extender,1,IN_AVM_02,Automotive Safety & Tech,1.0,seat belt extender | universal buckle adapter,This product directly enhances vehicle safety by improving the functionality and comfort of a seat belt.,v1,run_20260123_013928,gemini-2.5-flash,2026-01-23T01:39:28.622457
P055,Seat Belt Extender,2,IN_WR_01,Personal Relaxation & Comfort,0.9,for comfort,The primary purpose mentioned is to provide comfort to the user.,v1,run_20260123_013928,gemini-2.5-flash,2026-01-23T01:39:28.622457
P055,Seat Belt Extender,3,IN_TC_01,Travel Essentials & Efficiency,0.7,seat belt extender for comfort,"This item improves comfort during travel, making it an essential for some travelers.",v1,run_20260123_013928,gemini-2.5-flash,2026-01-23T01:39:28.622457
P055,Seat Belt Extender,4,IN_HMS_02,Home Safety & Security,0.6,seat belt,"Although for a vehicle, the core function relates to personal safety, aligning with the broader safety intent.",v1,run_20260123_013928,gemini-2.5-flash,2026-01-23T01:39:28.622457
P055,Seat Belt Extender,5,IN_AVM_01,Vehicle Maintenance & Repair,0.5,seat belt extender,"This is an accessory that modifies a vehicle component, which can be seen as a minor vehicle improvement.",v1,run_20260123_013928,gemini-2.5-flash,2026-01-23T01:39:28.622457
P056,Steering Wheel Cover,1,IN_AVM_02,Automotive Safety & Tech,1.0,steering wheel cover | grip for sun protection,"This product protects the steering wheel from sun damage and provides a better grip, contributing to vehicle safety and longevity.",v1,run_20260123_013928,gemini-2.5-flash,2026-01-23T01:39:28.622457
P056,Steering Wheel Cover,2,IN_AVM_01,Vehicle Maintenance & Repair,0.9,steering wheel cover for sun protection,The cover helps maintain the steering wheel's condition by protecting it from wear and sun damage.,v1,run_20260123_013928,gemini-2.5-flash,2026-01-23T01:39:28.622457
P056,Steering Wheel Cover,3,IN_WR_01,Personal Relaxation & Comfort,0.8,synthetic leather grip for sun protection,The cover enhances driver comfort by providing a better grip and protecting hands from a hot steering wheel.,v1,run_20260123_013928,gemini-2.5-flash,2026-01-23T01:39:28.622457
P056,Steering Wheel Cover,4,IN_TC_01,Travel Essentials & Efficiency,0.7,steering wheel cover,This accessory improves the driving experience and comfort during travel.,v1,run_20260123_013928,gemini-2.5-flash,2026-01-23T01:39:28.622457
P056,Steering Wheel Cover,5,IN_HDA_01,Enhancing Home Aesthetics,0.4,black synthetic leather,"While primarily functional, a steering wheel cover also contributes to the interior aesthetics of the vehicle, similar to how products enhance home aesthetics.",v1,run_20260123_013928,gemini-2.5-flash,2026-01-23T01:39:28.622457
P057,Car Interior Dust Gel,1,IN_AVM_01,Vehicle Maintenance & Repair,0.95,car interior dust gel,This product is specifically designed for cleaning and maintaining a vehicle's interior.,v1,run_20260123_013928,gemini-2.5-flash,2026-01-23T01:39:28.622457
P057,Car Interior Dust Gel,2,IN_CHE_01,Home Cleaning & Maintenance,0.85,cleaning dashboard vents,"The product's function is general cleaning and maintenance, applicable to any space.",v1,run_20260123_013928,gemini-2.5-flash,2026-01-23T01:39:28.622457
P057,Car Interior Dust Gel,3,IN_SEL_01,Eco-Conscious Products & Practices,0.7,reusable sticky gel,The 'reusable' aspect indicates an environmentally friendly product choice.,v1,run_20260123_013928,gemini-2.5-flash,2026-01-23T01:39:28.622457
P057,Car Interior Dust Gel,4,IN_HDA_01,Enhancing Home Aesthetics,0.6,car interior dust gel,A clean car interior improves the vehicle's overall appearance and atmosphere.,v1,run_20260123_013928,gemini-2.5-flash,2026-01-23T01:39:28.622457
P057,Car Interior Dust Gel,5,IN_AVM_02,Automotive Safety & Tech,0.4,cleaning dashboard vents,A clean and clear dashboard can indirectly contribute to a less distracting driving environment.,v1,run_20260123_013928,gemini-2.5-flash,2026-01-23T01:39:28.622457
P058,Windshield Sunshade,1,IN_AVM_02,Automotive Safety & Tech,0.9,windshield sunshade,"A sunshade protects the car's interior from heat and UV, preserving components and offering privacy.",v1,run_20260123_013928,gemini-2.5-flash,2026-01-23T01:39:28.622457
P058,Windshield Sunshade,2,IN_AVM_01,Vehicle Maintenance & Repair,0.85,car window cover,Protecting the car's interior from sun damage is a form of vehicle maintenance.,v1,run_20260123_013928,gemini-2.5-flash,2026-01-23T01:39:28.622457
P058,Windshield Sunshade,3,IN_TC_01,Travel Essentials & Efficiency,0.75,windshield sunshade,A sunshade makes travel more comfortable by keeping the car cooler.,v1,run_20260123_013928,gemini-2.5-flash,2026-01-23T01:39:28.622457
P058,Windshield Sunshade,4,IN_WR_01,Personal Relaxation & Comfort,0.6,car window cover,Keeping the car interior cooler enhances personal comfort for occupants.,v1,run_20260123_013928,gemini-2.5-flash,2026-01-23T01:39:28.622457
P058,Windshield Sunshade,5,IN_HDA_01,Enhancing Home Aesthetics,0.5,reflective silver accordion-style,The sunshade helps preserve the aesthetic condition of the car's interior by preventing sun damage.,v1,run_20260123_013928,gemini-2.5-flash,2026-01-23T01:39:28.622457
P059,License Plate Frame,1,IN_AVM_02,Automotive Safety & Tech,0.8,license plate frame,"A license plate frame can protect the license plate, ensuring its legibility and compliance.",v1,run_20260123_013928,gemini-2.5-flash,2026-01-23T01:39:28.622457
P059,License Plate Frame,2,IN_AVM_01,Vehicle Maintenance & Repair,0.7,license plate frame,This accessory helps maintain the integrity and appearance of a required vehicle component.,v1,run_20260123_013928,gemini-2.5-flash,2026-01-23T01:39:28.622457
P059,License Plate Frame,3,IN_HDA_01,Enhancing Home Aesthetics,0.65,simple black plastic frame,License plate frames are often chosen to personalize or enhance the vehicle's appearance.,v1,run_20260123_013928,gemini-2.5-flash,2026-01-23T01:39:28.622457
P059,License Plate Frame,4,IN_FA_02,Personal Accessories & Adornment,0.55,simple black plastic frame,A car accessory like a license plate frame can be an extension of personal style and adornment.,v1,run_20260123_013928,gemini-2.5-flash,2026-01-23T01:39:28.622457
P059,License Plate Frame,5,IN_GSO_01,Thoughtful & Personalized Gifts,0.4,license plate frame,This item is a common and practical gift for car owners.,v1,run_20260123_013928,gemini-2.5-flash,2026-01-23T01:39:28.622457
P060,OBD2 Scanner (Basic),1,IN_AVM_01,Vehicle Maintenance & Repair,0.98,obd2 scanner (basic),"This tool is essential for diagnosing and troubleshooting engine issues, directly supporting vehicle maintenance.",v1,run_20260123_013928,gemini-2.5-flash,2026-01-23T01:39:28.622457
P060,OBD2 Scanner (Basic),2,IN_AVM_02,Automotive Safety & Tech,0.9,engine diagnostic lights,Diagnosing engine problems contributes to vehicle safety by enabling timely repairs and preventing breakdowns.,v1,run_20260123_013928,gemini-2.5-flash,2026-01-23T01:39:28.622457
P060,OBD2 Scanner (Basic),3,IN_HMS_01,Home Repairs & DIY,0.75,code reader for engine diagnostic,"This device is a diagnostic tool for do-it-yourself car repair, similar to home repair tools.",v1,run_20260123_013928,gemini-2.5-flash,2026-01-23T01:39:28.622457
P060,OBD2 Scanner (Basic),4,IN_CET_01,Electronic Devices & Gadgets,0.6,obd2 scanner,An OBD2 scanner is an electronic device used for vehicle diagnostics and data retrieval.,v1,run_20260123_013928,gemini-2.5-flash,2026-01-23T01:39:28.622457
P060,OBD2 Scanner (Basic),5,IN_PBS_01,Advanced Work & Productivity,0.55,code reader,"For mechanics or serious DIYers, this is a robust digital tool that enhances productivity in vehicle diagnostics.",v1,run_20260123_013928,gemini-2.5-flash,2026-01-23T01:39:28.622457
P061,Car Trash Bag (Hanging),1,IN_TC_01,Travel Essentials & Efficiency,1.0,car trash bag (hanging),This product helps maintain cleanliness and organization during travel or commutes.,v1,run_20260123_013928,gemini-2.5-flash,2026-01-23T01:39:28.622457
P061,Car Trash Bag (Hanging),2,IN_HOS_01,Efficient Home Organization,0.7,small leak-proof bin,It provides a solution for decluttering and managing waste in a confined space.,v1,run_20260123_013928,gemini-2.5-flash,2026-01-23T01:39:28.622457
P061,Car Trash Bag (Hanging),3,IN_CHE_01,Home Cleaning & Maintenance,0.6,car trash bag,The product aids in keeping a space tidy and hygienic by containing waste.,v1,run_20260123_013928,gemini-2.5-flash,2026-01-23T01:39:28.622457
P061,Car Trash Bag (Hanging),4,IN_AVM_02,Automotive Safety & Tech,0.5,bin for back of seat,It improves the utility and comfort of the vehicle interior.,v1,run_20260123_013928,gemini-2.5-flash,2026-01-23T01:39:28.622457
P061,Car Trash Bag (Hanging),5,IN_GSO_01,Thoughtful & Personalized Gifts,0.3,car trash bag,This item could be a practical and thoughtful gift for a car owner.,v1,run_20260123_013928,gemini-2.5-flash,2026-01-23T01:39:28.622457
P062,Mirror Glue,1,IN_AVM_01,Vehicle Maintenance & Repair,1.0,mirror glue | high-strength adhesive for rearview mirrors,This product is specifically for repairing a component of a vehicle.,v1,run_20260123_013928,gemini-2.5-flash,2026-01-23T01:39:28.622457
P062,Mirror Glue,2,IN_HMS_01,Home Repairs & DIY,0.8,high-strength adhesive,"It is a material used for fixing and maintaining items, similar to general DIY.",v1,run_20260123_013928,gemini-2.5-flash,2026-01-23T01:39:28.622457
P062,Mirror Glue,3,IN_THI_01,General Tools & Hardware,0.7,high-strength adhesive,Adhesives are general purpose components used in various repair and DIY projects.,v1,run_20260123_013928,gemini-2.5-flash,2026-01-23T01:39:28.622457
P062,Mirror Glue,4,IN_AVM_02,Automotive Safety & Tech,0.6,rearview mirrors,Maintaining a rearview mirror is crucial for vehicle safety.,v1,run_20260123_013928,gemini-2.5-flash,2026-01-23T01:39:28.622457
P063,Gas Cap (Universal),1,IN_AVM_01,Vehicle Maintenance & Repair,1.0,gas cap (universal) | replacement tethered fuel tank cap,This is a replacement part essential for maintaining a vehicle's functionality.,v1,run_20260123_013928,gemini-2.5-flash,2026-01-23T01:39:28.622457
P063,Gas Cap (Universal),2,IN_AVM_02,Automotive Safety & Tech,0.9,fuel tank cap,A functional gas cap contributes to vehicle safety and proper operation.,v1,run_20260123_013928,gemini-2.5-flash,2026-01-23T01:39:28.622457
P063,Gas Cap (Universal),3,IN_HMS_01,Home Repairs & DIY,0.6,replacement,"It is a replacement part, aligning with the concept of fixing or maintaining items.",v1,run_20260123_013928,gemini-2.5-flash,2026-01-23T01:39:28.622457
P063,Gas Cap (Universal),4,IN_THI_01,General Tools & Hardware,0.5,gas cap,"This item is a functional component, similar to general hardware.",v1,run_20260123_013928,gemini-2.5-flash,2026-01-23T01:39:28.622457
P064,Car Air Freshener Tree,1,IN_AVM_02,Automotive Safety & Tech,1.0,car air freshener tree | pine-scented,This product enhances the comfort and atmosphere within a vehicle.,v1,run_20260123_013928,gemini-2.5-flash,2026-01-23T01:39:28.622457
P064,Car Air Freshener Tree,2,IN_TC_01,Travel Essentials & Efficiency,0.8,car air freshener tree,It contributes to a more pleasant and comfortable travel experience.,v1,run_20260123_013928,gemini-2.5-flash,2026-01-23T01:39:28.622457
P064,Car Air Freshener Tree,3,IN_HDA_01,Enhancing Home Aesthetics,0.7,pine-scented,The product aims to improve the atmosphere and sensory appeal of a personal space.,v1,run_20260123_013928,gemini-2.5-flash,2026-01-23T01:39:28.622457
P064,Car Air Freshener Tree,4,IN_CHE_01,Home Cleaning & Maintenance,0.6,air freshener,"It helps maintain a fresh and pleasant environment, similar to cleaning tasks.",v1,run_20260123_013928,gemini-2.5-flash,2026-01-23T01:39:28.622457
P064,Car Air Freshener Tree,5,IN_GSO_01,Thoughtful & Personalized Gifts,0.5,car air freshener tree,"This is a common and affordable item often given as a small, thoughtful gift.",v1,run_20260123_013928,gemini-2.5-flash,2026-01-23T01:39:28.622457
P065,Blind Spot Mirror,1,IN_AVM_02,Automotive Safety & Tech,1.0,Blind Spot Mirror,This product directly enhances vehicle safety by improving visibility.,v1,run_20260123_013928,gemini-2.5-flash,2026-01-23T01:39:28.622457
P065,Blind Spot Mirror,2,IN_AVM_01,Vehicle Maintenance & Repair,0.7,stick-on convex small mirrors,"It is an accessory that can be added to a vehicle, falling under general vehicle improvements.",v1,run_20260123_013928,gemini-2.5-flash,2026-01-23T01:39:28.622457
P066,Valve Stem Caps,1,IN_AVM_01,Vehicle Maintenance & Repair,1.0,valve stem caps | tire air caps,"These are essential components for vehicle tires, directly related to maintenance.",v1,run_20260123_013928,gemini-2.5-flash,2026-01-23T01:39:28.622457
P066,Valve Stem Caps,2,IN_AVM_02,Automotive Safety & Tech,0.8,tire air caps,"Maintaining proper tire pressure, which these caps help protect, is crucial for vehicle safety.",v1,run_20260123_013928,gemini-2.5-flash,2026-01-23T01:39:28.622457
P066,Valve Stem Caps,3,IN_GSO_01,Thoughtful & Personalized Gifts,0.3,4-pack,"This product could serve as a small, practical gift for a car owner.",v1,run_20260123_013928,gemini-2.5-flash,2026-01-23T01:39:28.622457
P067,Car Shammy Cloth,1,IN_AVM_01,Vehicle Maintenance & Repair,1.0,car shammy cloth | car wash,This product is specifically designed for cleaning and maintaining a vehicle.,v1,run_20260123_013928,gemini-2.5-flash,2026-01-23T01:39:28.622457
P067,Car Shammy Cloth,2,IN_CHE_01,Home Cleaning & Maintenance,0.7,drying towel for streak-free,"The core function of cleaning and drying is similar to general home cleaning, even if specified for cars.",v1,run_20260123_013928,gemini-2.5-flash,2026-01-23T01:39:28.622457
P067,Car Shammy Cloth,3,IN_GSO_01,Thoughtful & Personalized Gifts,0.3,large synthetic drying towel,This product could be a practical gift for someone who regularly washes their car.,v1,run_20260123_013928,gemini-2.5-flash,2026-01-23T01:39:28.622457
P068,Luxury Chocolate Truffles,1,IN_GSO_01,Thoughtful & Personalized Gifts,1.0,luxury chocolate truffles | box of 12 handcrafted artisanal,High-quality chocolates are a classic choice for thoughtful and appreciated gifts.,v1,run_20260123_013928,gemini-2.5-flash,2026-01-23T01:39:28.622457
P068,Luxury Chocolate Truffles,2,IN_PEP_01,Event Hosting & Supplies,0.9,luxury chocolate truffles | handcrafted artisanal,These truffles are suitable for serving guests and enhancing celebrations or events.,v1,run_20260123_013928,gemini-2.5-flash,2026-01-23T01:39:28.622457
P068,Luxury Chocolate Truffles,3,IN_KDE_02,Dining & Serveware,0.8,dark and milk chocolates,"Chocolates are often served as a dessert or treat, enhancing the dining experience.",v1,run_20260123_013928,gemini-2.5-flash,2026-01-23T01:39:28.622457
P068,Luxury Chocolate Truffles,4,IN_WR_01,Personal Relaxation & Comfort,0.7,luxury chocolate truffles,Indulging in luxury chocolates can be a form of personal pampering and stress relief.,v1,run_20260123_013928,gemini-2.5-flash,2026-01-23T01:39:28.622457
P068,Luxury Chocolate Truffles,5,IN_KDE_01,Cooking & Food Preparation,0.3,dark and milk chocolates,"While these are finished products, chocolate is a common ingredient in many food preparations.",v1,run_20260123_013928,gemini-2.5-flash,2026-01-23T01:39:28.622457
P069,Red Wine (Premium),1,IN_KDE_02,Dining & Serveware,1.0,750ml bottle of full-bodied cabernet sauvignon for date nights,Wine is typically consumed during dining and enhances meal presentation or special occasions.,v1,run_20260123_013928,gemini-2.5-flash,2026-01-23T01:39:28.622457
P069,Red Wine (Premium),2,IN_PEP_01,Event Hosting & Supplies,0.9,for date nights,Wine is often used to enhance celebrations or special events like date nights.,v1,run_20260123_013928,gemini-2.5-flash,2026-01-23T01:39:28.622457
P069,Red Wine (Premium),3,IN_GSO_01,Thoughtful & Personalized Gifts,0.7,premium,Premium wine can be a thoughtful gift for various occasions.,v1,run_20260123_013928,gemini-2.5-flash,2026-01-23T01:39:28.622457
P069,Red Wine (Premium),4,IN_WR_01,Personal Relaxation & Comfort,0.6,full-bodied cabernet sauvignon,Wine can be associated with relaxation and unwinding after a long day.,v1,run_20260123_013928,gemini-2.5-flash,2026-01-23T01:39:28.622457
P069,Red Wine (Premium),5,IN_HDA_01,Enhancing Home Aesthetics,0.4,premium,A nice bottle of wine can contribute to the atmosphere and aesthetic of a home setting.,v1,run_20260123_013928,gemini-2.5-flash,2026-01-23T01:39:28.622457
P070,Red Velvet Gift Box,1,IN_GSO_01,Thoughtful & Personalized Gifts,1.0,red velvet gift box | premium box of red velvet cupcakes with romantic message card,"This product is explicitly designed as a gift, often for special occasions.",v1,run_20260123_013928,gemini-2.5-flash,2026-01-23T01:39:28.622457
P070,Red Velvet Gift Box,2,IN_PEP_01,Event Hosting & Supplies,0.9,red velvet cupcakes with romantic message card,Cupcakes and gift boxes are frequently used for celebrations and events.,v1,run_20260123_013928,gemini-2.5-flash,2026-01-23T01:39:28.622457
P070,Red Velvet Gift Box,3,IN_KDE_02,Dining & Serveware,0.8,red velvet cupcakes,Cupcakes are food items served for dining or as a dessert.,v1,run_20260123_013928,gemini-2.5-flash,2026-01-23T01:39:28.622457
P070,Red Velvet Gift Box,4,IN_HDA_01,Enhancing Home Aesthetics,0.6,red velvet gift box,A beautifully presented gift box can contribute to the aesthetic and atmosphere of a special occasion at home.,v1,run_20260123_013928,gemini-2.5-flash,2026-01-23T01:39:28.622457
P070,Red Velvet Gift Box,5,IN_WR_01,Personal Relaxation & Comfort,0.5,red velvet cupcakes,Indulging in treats like cupcakes can be a form of personal comfort or relaxation.,v1,run_20260123_013928,gemini-2.5-flash,2026-01-23T01:39:28.622457
P071,Dried Fruit Gift Box,1,IN_GSO_01,Thoughtful & Personalized Gifts,1.0,dried fruit gift box,"The product is explicitly labeled as a gift box, indicating its primary purpose.",v1,run_20260123_013928,gemini-2.5-flash,2026-01-23T01:39:28.622457
