product_id,product_name,rank,intent_id,intent_name,score,evidence,reason,ontology_version,labeling_run_id,model,created_at
P117,Dish Rack (Plastic),1,IN_CHE_01,Home Cleaning & Maintenance,1.0,draining tray and rack,"A dish rack is primarily used for drying dishes after washing, which is a cleaning and maintenance task.",v1,run_20260123_013928,gemini-2.5-flash,2026-01-23T01:39:28.622457
P117,Dish Rack (Plastic),2,IN_HOS_01,Efficient Home Organization,0.8,counter-top draining tray and rack,It helps organize washed dishes efficiently on the counter.,v1,run_20260123_013928,gemini-2.5-flash,2026-01-23T01:39:28.622457
P117,Dish Rack (Plastic),3,IN_KDE_01,Cooking & Food Preparation,0.6,dish rack,"While not directly for cooking, it's an essential accessory in a kitchen where food is prepared.",v1,run_20260123_013928,gemini-2.5-flash,2026-01-23T01:39:28.622457
P117,Dish Rack (Plastic),4,IN_KDE_02,Dining & Serveware,0.5,dish rack,Dishes and serveware are often dried on a dish rack after use.,v1,run_20260123_013928,gemini-2.5-flash,2026-01-23T01:39:28.622457
P117,Dish Rack (Plastic),5,IN_HDA_01,Enhancing Home Aesthetics,0.3,simple counter-top draining tray and rack,Its design can subtly contribute to the overall look of the kitchen.,v1,run_20260123_013928,gemini-2.5-flash,2026-01-23T01:39:28.622457
P118,Salt Shaker (Single),1,IN_KDE_02,Dining & Serveware,1.0,salt shaker,A salt shaker is a common item used for seasoning food at the table during dining.,v1,run_20260123_013928,gemini-2.5-flash,2026-01-23T01:39:28.622457
P118,Salt Shaker (Single),2,IN_KDE_01,Cooking & Food Preparation,0.8,salt shaker,"Salt is a key ingredient in food preparation, and a shaker can be used during cooking.",v1,run_20260123_013928,gemini-2.5-flash,2026-01-23T01:39:28.622457
P118,Salt Shaker (Single),3,IN_HDA_01,Enhancing Home Aesthetics,0.7,basic glass dispenser with stainless steel top,Its design and material can contribute to the table setting's aesthetic.,v1,run_20260123_013928,gemini-2.5-flash,2026-01-23T01:39:28.622457
P118,Salt Shaker (Single),4,IN_HOS_01,Efficient Home Organization,0.5,dispenser,It provides an organized way to store and dispense salt.,v1,run_20260123_013928,gemini-2.5-flash,2026-01-23T01:39:28.622457
P118,Salt Shaker (Single),5,IN_CHE_01,Home Cleaning & Maintenance,0.3,glass dispenser,"As a kitchen item, it requires cleaning and maintenance to keep it hygienic.",v1,run_20260123_013928,gemini-2.5-flash,2026-01-23T01:39:28.622457
P119,Ice Cube Tray (2pk),1,IN_KDE_01,Cooking & Food Preparation,1.0,ice cube tray,"Ice cubes are a common ingredient or addition for beverages, which relates to food and drink preparation.",v1,run_20260123_013928,gemini-2.5-flash,2026-01-23T01:39:28.622457
P119,Ice Cube Tray (2pk),2,IN_HOS_01,Efficient Home Organization,0.8,trays for 16 cubes each,It provides a structured way to create and store ice cubes in the freezer.,v1,run_20260123_013928,gemini-2.5-flash,2026-01-23T01:39:28.622457
P119,Ice Cube Tray (2pk),3,IN_KDE_02,Dining & Serveware,0.7,ice cube tray,Ice cubes are often served with drinks during dining or entertaining.,v1,run_20260123_013928,gemini-2.5-flash,2026-01-23T01:39:28.622457
P119,Ice Cube Tray (2pk),4,IN_CHE_01,Home Cleaning & Maintenance,0.4,plastic trays,"As a reusable kitchen item, it needs regular cleaning and maintenance.",v1,run_20260123_013928,gemini-2.5-flash,2026-01-23T01:39:28.622457
P120,Pot Holders (2pk),1,IN_KDE_01,Cooking & Food Preparation,1.0,handling hot pans,Pot holders are essential safety tools used directly during the cooking and food preparation process.,v1,run_20260123_013928,gemini-2.5-flash,2026-01-23T01:39:28.622457
P120,Pot Holders (2pk),2,IN_HMS_02,Home Safety & Security,0.9,handling hot pans,They prevent burns and enhance safety when dealing with hot items in the kitchen.,v1,run_20260123_013928,gemini-2.5-flash,2026-01-23T01:39:28.622457
P120,Pot Holders (2pk),3,IN_CHE_01,Home Cleaning & Maintenance,0.6,padded cotton fabric,"As a fabric kitchen item, pot holders require cleaning and maintenance.",v1,run_20260123_013928,gemini-2.5-flash,2026-01-23T01:39:28.622457
P120,Pot Holders (2pk),4,IN_HDA_01,Enhancing Home Aesthetics,0.5,padded cotton fabric,Pot holders are often visible in the kitchen and can contribute to its decorative theme.,v1,run_20260123_013928,gemini-2.5-flash,2026-01-23T01:39:28.622457
P120,Pot Holders (2pk),5,IN_HOS_01,Efficient Home Organization,0.4,pot holders,"They are a specific tool for a kitchen task, contributing to an organized approach to cooking.",v1,run_20260123_013928,gemini-2.5-flash,2026-01-23T01:39:28.622457
P121,Cutting Board (Small),1,IN_KDE_01,Cooking & Food Preparation,1.0,chopping mat for quick food prep,A cutting board is a primary tool for preparing food ingredients.,v1,run_20260123_013928,gemini-2.5-flash,2026-01-23T01:39:28.622457
P121,Cutting Board (Small),2,IN_HOS_01,Efficient Home Organization,0.7,small,A small cutting board is ideal for efficient storage in compact kitchens.,v1,run_20260123_013928,gemini-2.5-flash,2026-01-23T01:39:28.622457
P121,Cutting Board (Small),3,IN_CHE_01,Home Cleaning & Maintenance,0.6,plastic,Plastic cutting boards are often chosen for their ease of cleaning and hygiene.,v1,run_20260123_013928,gemini-2.5-flash,2026-01-23T01:39:28.622457
P121,Cutting Board (Small),4,IN_KDE_02,Dining & Serveware,0.3,cutting board,Some cutting boards can also be used for serving prepared foods.,v1,run_20260123_013928,gemini-2.5-flash,2026-01-23T01:39:28.622457
P122,Bottle Opener (Wall),1,IN_KDE_02,Dining & Serveware,1.0,bottle opener for soda and beer,This item is directly used for serving beverages during meals or gatherings.,v1,run_20260123_013928,gemini-2.5-flash,2026-01-23T01:39:28.622457
P122,Bottle Opener (Wall),2,IN_PEP_01,Event Hosting & Supplies,0.9,bottle opener for soda and beer,A bottle opener is an essential item for serving drinks when hosting guests or events.,v1,run_20260123_013928,gemini-2.5-flash,2026-01-23T01:39:28.622457
P122,Bottle Opener (Wall),3,IN_HDA_01,Enhancing Home Aesthetics,0.7,metal mountable opener,A stylish wall-mounted opener can enhance the aesthetic of a kitchen or bar area.,v1,run_20260123_013928,gemini-2.5-flash,2026-01-23T01:39:28.622457
P122,Bottle Opener (Wall),4,IN_HOS_01,Efficient Home Organization,0.6,wall | mountable,A wall-mounted opener helps save counter space and provides efficient access.,v1,run_20260123_013928,gemini-2.5-flash,2026-01-23T01:39:28.622457
P122,Bottle Opener (Wall),5,IN_HMS_01,Home Repairs & DIY,0.3,mountable,Installing a wall-mounted opener involves a minor DIY task.,v1,run_20260123_013928,gemini-2.5-flash,2026-01-23T01:39:28.622457
P123,Plastic Drinking Straws,1,IN_KDE_02,Dining & Serveware,1.0,drinking straws,"Straws are used for consuming beverages, enhancing the dining or serving experience.",v1,run_20260123_013928,gemini-2.5-flash,2026-01-23T01:39:28.622457
P123,Plastic Drinking Straws,2,IN_PEP_01,Event Hosting & Supplies,0.9,100-pack of flexible multi-colored straws,A large pack of multi-colored straws is ideal for parties and social gatherings.,v1,run_20260123_013928,gemini-2.5-flash,2026-01-23T01:39:28.622457
P123,Plastic Drinking Straws,3,IN_BKE_02,Kids' Play & Development,0.4,multi-colored straws,Multi-colored straws are often appealing to children for their drinks.,v1,run_20260123_013928,gemini-2.5-flash,2026-01-23T01:39:28.622457
P124,Toothpick Dispenser,1,IN_KDE_02,Dining & Serveware,1.0,toothpick dispenser for table use,This item is used at the table for dining or post-meal convenience.,v1,run_20260123_013928,gemini-2.5-flash,2026-01-23T01:39:28.622457
P124,Toothpick Dispenser,2,IN_HOS_01,Efficient Home Organization,0.8,dispenser | small,A dispenser provides an organized and efficient way to store and access toothpicks.,v1,run_20260123_013928,gemini-2.5-flash,2026-01-23T01:39:28.622457
P124,Toothpick Dispenser,3,IN_HDA_01,Enhancing Home Aesthetics,0.7,clear plastic shaker for table use,"A clear, small dispenser can contribute to a tidy and appealing table setting.",v1,run_20260123_013928,gemini-2.5-flash,2026-01-23T01:39:28.622457
P124,Toothpick Dispenser,4,IN_PCH_01,Daily Hygiene & Grooming,0.6,toothpick,Toothpicks are commonly used for oral hygiene after meals.,v1,run_20260123_013928,gemini-2.5-flash,2026-01-23T01:39:28.622457
P124,Toothpick Dispenser,5,IN_PEP_01,Event Hosting & Supplies,0.5,toothpick dispenser for table use,A toothpick dispenser is a common item to offer guests when hosting.,v1,run_20260123_013928,gemini-2.5-flash,2026-01-23T01:39:28.622457
P125,Coasters (Cork),1,IN_KDE_02,Dining & Serveware,1.0,coasters (cork),Coasters are used for serving and protecting surfaces during dining.,v1,run_20260123_013928,gemini-2.5-flash,2026-01-23T01:39:28.622457
P125,Coasters (Cork),2,IN_HDA_01,Enhancing Home Aesthetics,0.8,plain round absorbent cork pads,Coasters can contribute to the visual appeal and atmosphere of a dining or living space.,v1,run_20260123_013928,gemini-2.5-flash,2026-01-23T01:39:28.622457
P125,Coasters (Cork),3,IN_HOS_01,Efficient Home Organization,0.6,coasters,"Coasters help organize and protect surfaces, contributing to a tidy home.",v1,run_20260123_013928,gemini-2.5-flash,2026-01-23T01:39:28.622457
P125,Coasters (Cork),4,IN_PEP_01,Event Hosting & Supplies,0.5,coasters,Coasters are often used when hosting guests or for events to protect furniture.,v1,run_20260123_013928,gemini-2.5-flash,2026-01-23T01:39:28.622457
P125,Coasters (Cork),5,IN_GSO_01,Thoughtful & Personalized Gifts,0.5,coasters,Coasters are common household items that can be given as practical gifts.,v1,run_20260123_013928,gemini-2.5-flash,2026-01-23T01:39:28.622457
P126,Tinfoil Pans (3pk),1,IN_KDE_01,Cooking & Food Preparation,1.0,tinfoil pans,These pans are specifically designed for cooking and preparing food in an oven.,v1,run_20260123_013928,gemini-2.5-flash,2026-01-23T01:39:28.622457
P126,Tinfoil Pans (3pk),2,IN_PEP_01,Event Hosting & Supplies,0.8,disposable aluminum trays,Disposable pans are convenient for serving food at events or gatherings.,v1,run_20260123_013928,gemini-2.5-flash,2026-01-23T01:39:28.622457
P126,Tinfoil Pans (3pk),3,IN_KDE_02,Dining & Serveware,0.7,disposable aluminum trays,"While primarily for cooking, these trays can also be used for serving food.",v1,run_20260123_013928,gemini-2.5-flash,2026-01-23T01:39:28.622457
P126,Tinfoil Pans (3pk),4,IN_CHE_01,Home Cleaning & Maintenance,0.6,disposable aluminum trays,"Disposable pans reduce cleanup effort, contributing to home maintenance.",v1,run_20260123_013928,gemini-2.5-flash,2026-01-23T01:39:28.622457
P126,Tinfoil Pans (3pk),5,IN_HOS_01,Efficient Home Organization,0.5,disposable aluminum trays for oven use,"Disposable pans can streamline meal preparation and cleanup, contributing to efficient home management.",v1,run_20260123_013928,gemini-2.5-flash,2026-01-23T01:39:28.622457
P127,Ziploc Bags (Quart),1,IN_HOS_01,Efficient Home Organization,1.0,slider-seal storage bags,These bags are designed for storing and organizing various items efficiently within the home.,v1,run_20260123_013928,gemini-2.5-flash,2026-01-23T01:39:28.622457
P127,Ziploc Bags (Quart),2,IN_KDE_01,Cooking & Food Preparation,0.9,storage bags,Ziploc bags are commonly used for storing food ingredients or prepared food.,v1,run_20260123_013928,gemini-2.5-flash,2026-01-23T01:39:28.622457
P127,Ziploc Bags (Quart),3,IN_CHE_01,Home Cleaning & Maintenance,0.7,storage bags,"These bags can be used for waste management or storing cleaning supplies, contributing to home maintenance.",v1,run_20260123_013928,gemini-2.5-flash,2026-01-23T01:39:28.622457
P127,Ziploc Bags (Quart),4,IN_TC_01,Travel Essentials & Efficiency,0.6,storage bags,Ziploc bags are useful for organizing and packing items for travel or daily commutes.,v1,run_20260123_013928,gemini-2.5-flash,2026-01-23T01:39:28.622457
P127,Ziploc Bags (Quart),5,IN_OSS_01,Office & School Supplies,0.5,storage bags,These bags can be used to organize and store small items or supplies in an office or school setting.,v1,run_20260123_013928,gemini-2.5-flash,2026-01-23T01:39:28.622457
P128,Sponges (Cellulose),1,IN_CHE_01,Home Cleaning & Maintenance,1.0,absorbent yellow cleaning sponges,"Sponges are essential tools for keeping living spaces tidy, hygienic, and well-maintained.",v1,run_20260123_013928,gemini-2.5-flash,2026-01-23T01:39:28.622457
P128,Sponges (Cellulose),2,IN_CHE_02,Eco-Friendly Household Solutions,0.9,sponges (cellulose),"Cellulose is a plant-based material, often considered a more environmentally friendly option for household products.",v1,run_20260123_013928,gemini-2.5-flash,2026-01-23T01:39:28.622457
P128,Sponges (Cellulose),3,IN_KDE_01,Cooking & Food Preparation,0.7,cleaning sponges,Sponges are frequently used for cleaning dishes and kitchen surfaces after cooking and food preparation.,v1,run_20260123_013928,gemini-2.5-flash,2026-01-23T01:39:28.622457
P128,Sponges (Cellulose),4,IN_HOS_01,Efficient Home Organization,0.6,cleaning sponges,Having appropriate cleaning tools like sponges contributes to maintaining an organized and functional home.,v1,run_20260123_013928,gemini-2.5-flash,2026-01-23T01:39:28.622457
P128,Sponges (Cellulose),5,IN_HMS_01,Home Repairs & DIY,0.5,sponges,Sponges can be used for various cleaning tasks associated with home repairs or DIY projects.,v1,run_20260123_013928,gemini-2.5-flash,2026-01-23T01:39:28.622457
P129,Instant Film Camera,1,IN_PV_01,Camera Gear & Accessories,1.0,instant film camera | analog camera,The product is explicitly a type of camera.,v1,run_20260123_013928,gemini-2.5-flash,2026-01-23T01:39:28.622457
P129,Instant Film Camera,2,IN_GSO_01,Thoughtful & Personalized Gifts,0.7,capturing romantic memories and dates,"Cameras are often used to create lasting memories, which can be associated with thoughtful gifts.",v1,run_20260123_013928,gemini-2.5-flash,2026-01-23T01:39:28.622457
P129,Instant Film Camera,3,IN_PEP_01,Event Hosting & Supplies,0.6,capturing romantic memories and dates,Capturing memories is a common activity during events and celebrations.,v1,run_20260123_013928,gemini-2.5-flash,2026-01-23T01:39:28.622457
P129,Instant Film Camera,4,IN_ACH_01,Creative Pursuits & Supplies,0.5,analog camera,"Photography, especially with analog cameras, can be considered a creative pursuit.",v1,run_20260123_013928,gemini-2.5-flash,2026-01-23T01:39:28.622457
P129,Instant Film Camera,5,IN_HDA_01,Enhancing Home Aesthetics,0.4,capturing romantic memories,Photos captured can be used to decorate and enhance home aesthetics.,v1,run_20260123_013928,gemini-2.5-flash,2026-01-23T01:39:28.622457
P130,Noise-Canceling Headphones,1,IN_BMM_02,Music & Audio Entertainment,1.0,noise-canceling headphones | active noise-canceling over-ear headphones,Headphones are primarily used for listening to audio content.,v1,run_20260123_013928,gemini-2.5-flash,2026-01-23T01:39:28.622457
P130,Noise-Canceling Headphones,2,IN_CET_01,Electronic Devices & Gadgets,0.9,noise-canceling headphones | active noise-canceling over-ear headphones,Headphones are electronic devices for personal use.,v1,run_20260123_013928,gemini-2.5-flash,2026-01-23T01:39:28.622457
P130,Noise-Canceling Headphones,3,IN_PBS_01,Advanced Work & Productivity,0.8,for study focus,The noise-canceling feature directly supports productivity by aiding focus.,v1,run_20260123_013928,gemini-2.5-flash,2026-01-23T01:39:28.622457
P130,Noise-Canceling Headphones,4,IN_OSS_01,Office & School Supplies,0.7,for study focus,Headphones used for study focus are relevant for school or home study environments.,v1,run_20260123_013928,gemini-2.5-flash,2026-01-23T01:39:28.622457
P130,Noise-Canceling Headphones,5,IN_WR_01,Personal Relaxation & Comfort,0.6,noise-canceling,Noise-canceling can contribute to a more relaxed and comfortable environment.,v1,run_20260123_013928,gemini-2.5-flash,2026-01-23T01:39:28.622457
P131,Smart Digital Photo Frame,1,IN_HDA_01,Enhancing Home Aesthetics,1.0,digital photo frame | frame for sharing family celebration photos,"Photo frames are used to display images, directly enhancing the visual appeal of a living space.",v1,run_20260123_013928,gemini-2.5-flash,2026-01-23T01:39:28.622457
P131,Smart Digital Photo Frame,2,IN_HASD_01,Smart Home & Appliance Upgrades,0.9,smart digital photo frame | wi-fi connected frame,"The product is a smart, connected device for home functionality.",v1,run_20260123_013928,gemini-2.5-flash,2026-01-23T01:39:28.622457
P131,Smart Digital Photo Frame,3,IN_CET_01,Electronic Devices & Gadgets,0.8,smart digital photo frame | wi-fi connected frame,This is an electronic device for displaying digital content.,v1,run_20260123_013928,gemini-2.5-flash,2026-01-23T01:39:28.622457
P131,Smart Digital Photo Frame,4,IN_GSO_01,Thoughtful & Personalized Gifts,0.7,sharing family celebration photos,A photo frame filled with family memories makes a thoughtful and personalized gift.,v1,run_20260123_013928,gemini-2.5-flash,2026-01-23T01:39:28.622457
P131,Smart Digital Photo Frame,5,IN_PEP_01,Event Hosting & Supplies,0.6,sharing family celebration photos,Displaying celebration photos is relevant to events and gatherings.,v1,run_20260123_013928,gemini-2.5-flash,2026-01-23T01:39:28.622457
P132,Portable Beverage Cooler,1,IN_PEP_01,Event Hosting & Supplies,1.0,for wedding outdoor celebrations,The cooler is explicitly designed for use at events and celebrations.,v1,run_20260123_013928,gemini-2.5-flash,2026-01-23T01:39:28.622457
P132,Portable Beverage Cooler,2,IN_GOL_02,Outdoor Space Enhancement,0.9,outdoor celebrations,The cooler is suitable for use in outdoor living areas.,v1,run_20260123_013928,gemini-2.5-flash,2026-01-23T01:39:28.622457
P132,Portable Beverage Cooler,3,IN_KDE_02,Dining & Serveware,0.8,beverage cooler,"A beverage cooler is used for serving drinks, enhancing meal presentation and convenience.",v1,run_20260123_013928,gemini-2.5-flash,2026-01-23T01:39:28.622457
P132,Portable Beverage Cooler,4,IN_TC_01,Travel Essentials & Efficiency,0.7,portable beverage cooler | compact electric cooler,Its portability and compact nature make it suitable for travel or moving to different locations.,v1,run_20260123_013928,gemini-2.5-flash,2026-01-23T01:39:28.622457
P132,Portable Beverage Cooler,5,IN_HASD_01,Smart Home & Appliance Upgrades,0.6,electric cooler,"As an electric appliance, it contributes to home functionality, even if portable.",v1,run_20260123_013928,gemini-2.5-flash,2026-01-23T01:39:28.622457
P133,Smoke Machine,1,IN_PEP_01,Event Hosting & Supplies,1.0,for hosting,The product is explicitly designed for event hosting purposes.,v1,run_20260123_013928,gemini-2.5-flash,2026-01-23T01:39:28.622457
P133,Smoke Machine,2,IN_HDA_01,Enhancing Home Aesthetics,0.7,led lights,LED lights can enhance the visual atmosphere of a space.,v1,run_20260123_013928,gemini-2.5-flash,2026-01-23T01:39:28.622457
P133,Smoke Machine,3,IN_CET_01,Electronic Devices & Gadgets,0.6,smoke machine,A smoke machine is an electronic device.,v1,run_20260123_013928,gemini-2.5-flash,2026-01-23T01:39:28.622457
P133,Smoke Machine,4,IN_ACH_01,Creative Pursuits & Supplies,0.5,fog machine with led lights,It can be used for special effects in creative projects or performances.,v1,run_20260123_013928,gemini-2.5-flash,2026-01-23T01:39:28.622457
P133,Smoke Machine,5,IN_GSO_01,Thoughtful & Personalized Gifts,0.4,for hosting,This could be a suitable gift for someone who enjoys hosting events.,v1,run_20260123_013928,gemini-2.5-flash,2026-01-23T01:39:28.622457
P134,Cooling Neck Fan,1,IN_WR_01,Personal Relaxation & Comfort,1.0,cooling neck fan for beach heat,The product provides personal comfort and relief from heat.,v1,run_20260123_013928,gemini-2.5-flash,2026-01-23T01:39:28.622457
P134,Cooling Neck Fan,2,IN_TC_01,Travel Essentials & Efficiency,0.9,portable usb fan,Its portability makes it ideal for travel or outdoor excursions.,v1,run_20260123_013928,gemini-2.5-flash,2026-01-23T01:39:28.622457
P134,Cooling Neck Fan,3,IN_ORS_01,Outdoor Gear & Activities,0.8,for beach heat,It is designed for use in outdoor environments like the beach.,v1,run_20260123_013928,gemini-2.5-flash,2026-01-23T01:39:28.622457
P134,Cooling Neck Fan,4,IN_CET_01,Electronic Devices & Gadgets,0.7,usb fan,It is an electronic device for personal use.,v1,run_20260123_013928,gemini-2.5-flash,2026-01-23T01:39:28.622457
P134,Cooling Neck Fan,5,IN_GSO_01,Thoughtful & Personalized Gifts,0.6,cooling neck fan,This could be a practical gift for someone who spends time outdoors or in hot climates.,v1,run_20260123_013928,gemini-2.5-flash,2026-01-23T01:39:28.622457
P135,Electric Hand Warmer,1,IN_WR_01,Personal Relaxation & Comfort,1.0,hand warmer for cold-season comfort,The product directly provides warmth and comfort to the user.,v1,run_20260123_013928,gemini-2.5-flash,2026-01-23T01:39:28.622457
P135,Electric Hand Warmer,2,IN_TC_01,Travel Essentials & Efficiency,0.9,rechargeable pocket warmer,Its portability makes it suitable for travel or daily commutes in cold weather.,v1,run_20260123_013928,gemini-2.5-flash,2026-01-23T01:39:28.622457
P135,Electric Hand Warmer,3,IN_ORS_01,Outdoor Gear & Activities,0.8,pocket warmer for cold-season,It is useful for staying warm during outdoor activities in cold weather.,v1,run_20260123_013928,gemini-2.5-flash,2026-01-23T01:39:28.622457
P135,Electric Hand Warmer,4,IN_CET_01,Electronic Devices & Gadgets,0.7,"electric hand warmer, rechargeable",It is a rechargeable electronic device.,v1,run_20260123_013928,gemini-2.5-flash,2026-01-23T01:39:28.622457
P135,Electric Hand Warmer,5,IN_GSO_01,Thoughtful & Personalized Gifts,0.6,electric hand warmer,This could be a thoughtful gift for someone sensitive to cold or who spends time outdoors.,v1,run_20260123_013928,gemini-2.5-flash,2026-01-23T01:39:28.622457
P136,Smartwatch Series 9,1,IN_CET_01,Electronic Devices & Gadgets,1.0,"smartwatch series 9, tech upgrade",A smartwatch is a prime example of an electronic device or gadget.,v1,run_20260123_013928,gemini-2.5-flash,2026-01-23T01:39:28.622457
P136,Smartwatch Series 9,2,IN_FA_02,Personal Accessories & Adornment,0.9,smartwatch,A smartwatch is worn as a personal accessory.,v1,run_20260123_013928,gemini-2.5-flash,2026-01-23T01:39:28.622457
P136,Smartwatch Series 9,3,IN_PBS_01,Advanced Work & Productivity,0.8,smartwatch,Smartwatches often offer features that enhance productivity and organization.,v1,run_20260123_013928,gemini-2.5-flash,2026-01-23T01:39:28.622457
P136,Smartwatch Series 9,4,IN_HF_01,Fitness & Exercise Equipment,0.7,smartwatch,Many smartwatches have fitness tracking capabilities.,v1,run_20260123_013928,gemini-2.5-flash,2026-01-23T01:39:28.622457
P136,Smartwatch Series 9,5,IN_GSO_01,Thoughtful & Personalized Gifts,0.6,high-value tech upgrade,A high-value tech item like this is often purchased as a gift.,v1,run_20260123_013928,gemini-2.5-flash,2026-01-23T01:39:28.622457
P137,Robot Vacuum & Mop,1,IN_CHE_01,Home Cleaning & Maintenance,1.0,"robot vacuum & mop, automated cleaner",This product directly provides solutions for keeping living spaces tidy and hygienic.,v1,run_20260123_013928,gemini-2.5-flash,2026-01-23T01:39:28.622457
P137,Robot Vacuum & Mop,2,IN_HASD_01,Smart Home & Appliance Upgrades,0.95,"robot vacuum & mop, laser-mapping automated cleaner","It is a modern, automated device that improves home functionality.",v1,run_20260123_013928,gemini-2.5-flash,2026-01-23T01:39:28.622457
P137,Robot Vacuum & Mop,3,IN_CET_01,Electronic Devices & Gadgets,0.7,robot vacuum & mop,A robot vacuum is an electronic device for home utility.,v1,run_20260123_013928,gemini-2.5-flash,2026-01-23T01:39:28.622457
P137,Robot Vacuum & Mop,4,IN_HDA_01,Enhancing Home Aesthetics,0.6,automated cleaner,A clean home contributes to an enhanced aesthetic.,v1,run_20260123_013928,gemini-2.5-flash,2026-01-23T01:39:28.622457
P137,Robot Vacuum & Mop,5,IN_HOS_01,Efficient Home Organization,0.5,automated cleaner,Automated cleaning contributes to a well-managed and efficient home environment.,v1,run_20260123_013928,gemini-2.5-flash,2026-01-23T01:39:28.622457
P138,Gaming Console (Next-Gen),1,IN_GE_01,Video Games & Consoles,1.0,gaming console,This product is the core item for interactive digital entertainment.,v1,run_20260123_013928,gemini-2.5-flash,2026-01-23T01:39:28.622457
P138,Gaming Console (Next-Gen),2,IN_CET_01,Electronic Devices & Gadgets,0.9,"gaming console, latest hardware",A gaming console is a sophisticated electronic device.,v1,run_20260123_013928,gemini-2.5-flash,2026-01-23T01:39:28.622457
P138,Gaming Console (Next-Gen),3,IN_BMM_02,Music & Audio Entertainment,0.7,gaming console,Modern gaming consoles often serve as comprehensive media centers for audio and video content.,v1,run_20260123_013928,gemini-2.5-flash,2026-01-23T01:39:28.622457
P138,Gaming Console (Next-Gen),4,IN_WR_01,Personal Relaxation & Comfort,0.65,gaming console,Gaming provides a form of entertainment and relaxation.,v1,run_20260123_013928,gemini-2.5-flash,2026-01-23T01:39:28.622457
P138,Gaming Console (Next-Gen),5,IN_GSO_01,Thoughtful & Personalized Gifts,0.6,bfcm category promotion,"Gaming consoles are popular gifts, especially during promotional periods.",v1,run_20260123_013928,gemini-2.5-flash,2026-01-23T01:39:28.622457
P139,Soundbar (Dolby Atmos),1,IN_BMM_02,Music & Audio Entertainment,1.0,"soundbar, home theater audio system",This product is specifically designed to enhance audio content for entertainment.,v1,run_20260123_013928,gemini-2.5-flash,2026-01-23T01:39:28.622457
P139,Soundbar (Dolby Atmos),2,IN_HASD_01,Smart Home & Appliance Upgrades,0.9,"soundbar, home theater audio system","It is an upgrade to home functionality, specifically for entertainment systems.",v1,run_20260123_013928,gemini-2.5-flash,2026-01-23T01:39:28.622457
P139,Soundbar (Dolby Atmos),3,IN_CET_01,Electronic Devices & Gadgets,0.85,"soundbar, home theater audio system",A soundbar is an electronic device for home entertainment.,v1,run_20260123_013928,gemini-2.5-flash,2026-01-23T01:39:28.622457
